{
  "schema_version": 1,
  "generated_at": "2026-05-21T08:16:33+00:00",
  "source_policy": {
    "path": "ops/reader_reward_policy.json",
    "sha256": "7d900b654e99bd98cd635fbb5399657f0932dd51c7b553ebb0089604b5af98f0"
  },
  "source_reader_promise": {
    "path": "state/project_reader_promise.json",
    "sha256": "d2a343532d1404c1737b5aebaa7484fc5d04b73ab442ab6caa16be408d006e0c"
  },
  "chapters": [
    {
      "chapter": "v01_c001",
      "reader_reward_intensity": "R0",
      "gate": {
        "path": "reviews/v01_c001/reader_reward_gate.json",
        "sha256": "68a11df3e4c50cd7ae749faf161478a9cf296834b7f8a57e99fb0042150a020f"
      },
      "status": "BLOCKED",
      "waiting_ending_run": 0,
      "core_mechanism_silent_run": 0,
      "small_payoff_gap": 1,
      "low_drama_repeat_run": 0,
      "cross_blockers": [],
      "cross_warnings": []
    }
  ],
  "blockers": [],
  "warnings": []
}
